{
  "$schema": "./schemas/edge-tension.schema.json",
  "$version": "2.0.0",
  "$generatedAt": "2025-12-26T19:49:43.402Z",
  "$source": "CSV_Edge_tension_Map.csv",
  "$philosophy": {
    "purpose": "Map of 30 connections between organizational domains",
    "sacredGeometry": "Each edge connects two faces of the dodecahedron",
    "interpretation": {
      "lowTension": "Breath Ratio close to 1.0 = balanced energy exchange",
      "highTension": "Ratio > 2.0 or < 0.5 = one-way flow, intervention needed"
    }
  },
  "$topology": {
    "expectedEdges": 30,
    "actualEdges": 30,
    "validated": true,
    "violations": [],
    "elementalDistribution": {
      "Fire": 0,
      "Water": 0,
      "Air": 0,
      "Earth": 0,
      "Ether": 0
    }
  },
  "$integrityReport": {
    "totalRecords": 30,
    "substitutionCount": 30,
    "incompleteData": null,
    "substitutions": [
      {
        "field": "edges[0]",
        "edgeId": "E5-9",
        "original": "Market Resonance ? Regenerative Flow",
        "substitutedWith": "0",
        "reason": "Corruption pattern detected"
      },
      {
        "field": "edges[1]",
        "edgeId": "E5-8",
        "original": "Market Resonance ? Core Operations",
        "substitutedWith": "0",
        "reason": "Corruption pattern detected"
      },
      {
        "field": "edges[2]",
        "edgeId": "E5-7",
        "original": "Market Resonance ? Brand & Reputation",
        "substitutedWith": "0",
        "reason": "Corruption pattern detected"
      },
      {
        "field": "edges[3]",
        "edgeId": "E5-12",
        "original": "Market Resonance ? Risk & Resilience",
        "substitutedWith": "0",
        "reason": "Corruption pattern detected"
      },
      {
        "field": "edges[4]",
        "edgeId": "E3-9",
        "original": "Human Capital ? Regenerative Flow",
        "substitutedWith": "0",
        "reason": "Corruption pattern detected"
      },
      {
        "field": "edges[5]",
        "edgeId": "E8-10",
        "original": "Core Operations ? Foundational Values",
        "substitutedWith": "0",
        "reason": "Corruption pattern detected"
      },
      {
        "field": "edges[6]",
        "edgeId": "E4-9",
        "original": "Structural Capital ? Regenerative Flow",
        "substitutedWith": "0",
        "reason": "Corruption pattern detected"
      },
      {
        "field": "edges[7]",
        "edgeId": "E1-10",
        "original": "Financial Capital ? Foundational Values",
        "substitutedWith": "0",
        "reason": "Corruption pattern detected"
      },
      {
        "field": "edges[8]",
        "edgeId": "E1-2",
        "original": "Financial Capital ? Intellectual Capital",
        "substitutedWith": "0",
        "reason": "Corruption pattern detected"
      },
      {
        "field": "edges[9]",
        "edgeId": "E11-12",
        "original": "Funding Pipeline ? Risk & Resilience",
        "substitutedWith": "0",
        "reason": "Corruption pattern detected"
      },
      {
        "field": "edges[10]",
        "edgeId": "E3-6",
        "original": "Human Capital ? Community & Partners",
        "substitutedWith": "0",
        "reason": "Corruption pattern detected"
      },
      {
        "field": "edges[11]",
        "edgeId": "E3-4",
        "original": "Human Capital ? Structural Capital",
        "substitutedWith": "0",
        "reason": "Corruption pattern detected"
      },
      {
        "field": "edges[12]",
        "edgeId": "E7-8",
        "original": "Brand & Reputation ? Core Operations",
        "substitutedWith": "0",
        "reason": "Corruption pattern detected"
      },
      {
        "field": "edges[13]",
        "edgeId": "E2-10",
        "original": "Intellectual Capital ? Foundational Values",
        "substitutedWith": "0",
        "reason": "Corruption pattern detected"
      },
      {
        "field": "edges[14]",
        "edgeId": "E1-6",
        "original": "Financial Capital ? Community & Partners",
        "substitutedWith": "0",
        "reason": "Corruption pattern detected"
      },
      {
        "field": "edges[15]",
        "edgeId": "E4-6",
        "original": "Structural Capital ? Community & Partners",
        "substitutedWith": "0",
        "reason": "Corruption pattern detected"
      },
      {
        "field": "edges[16]",
        "edgeId": "E1-8",
        "original": "Financial Capital ? Core Operations",
        "substitutedWith": "0",
        "reason": "Corruption pattern detected"
      },
      {
        "field": "edges[17]",
        "edgeId": "E8-12",
        "original": "Core Operations ? Risk & Resilience",
        "substitutedWith": "0",
        "reason": "Corruption pattern detected"
      },
      {
        "field": "edges[18]",
        "edgeId": "E1-7",
        "original": "Financial Capital ? Brand & Reputation",
        "substitutedWith": "0",
        "reason": "Corruption pattern detected"
      },
      {
        "field": "edges[19]",
        "edgeId": "E4-7",
        "original": "Structural Capital ? Brand & Reputation",
        "substitutedWith": "0",
        "reason": "Corruption pattern detected"
      },
      {
        "field": "edges[20]",
        "edgeId": "E6-7",
        "original": "Community & Partners ? Brand & Reputation",
        "substitutedWith": "0",
        "reason": "Corruption pattern detected"
      },
      {
        "field": "edges[21]",
        "edgeId": "E3-11",
        "original": "Human Capital ? Funding Pipeline",
        "substitutedWith": "0",
        "reason": "Corruption pattern detected"
      },
      {
        "field": "edges[22]",
        "edgeId": "E2-6",
        "original": "Intellectual Capital ? Community & Partners",
        "substitutedWith": "0",
        "reason": "Corruption pattern detected"
      },
      {
        "field": "edges[23]",
        "edgeId": "E10-12",
        "original": "Foundational Values ? Risk & Resilience",
        "substitutedWith": "0",
        "reason": "Corruption pattern detected"
      },
      {
        "field": "edges[24]",
        "edgeId": "E9-12",
        "original": "Regenerative Flow ? Risk & Resilience",
        "substitutedWith": "0",
        "reason": "Corruption pattern detected"
      },
      {
        "field": "edges[25]",
        "edgeId": "E2-3",
        "original": "Intellectual Capital ? Human Capital",
        "substitutedWith": "0",
        "reason": "Corruption pattern detected"
      },
      {
        "field": "edges[26]",
        "edgeId": "E2-11",
        "original": "Intellectual Capital ? Funding Pipeline",
        "substitutedWith": "0",
        "reason": "Corruption pattern detected"
      },
      {
        "field": "edges[27]",
        "edgeId": "E10-11",
        "original": "Foundational Values ? Funding Pipeline",
        "substitutedWith": "0",
        "reason": "Corruption pattern detected"
      },
      {
        "field": "edges[28]",
        "edgeId": "E9-11",
        "original": "Regenerative Flow ? Funding Pipeline",
        "substitutedWith": "0",
        "reason": "Corruption pattern detected"
      },
      {
        "field": "edges[29]",
        "edgeId": "E4-5",
        "original": "Structural Capital ? Market Resonance",
        "substitutedWith": "0",
        "reason": "Corruption pattern detected"
      }
    ]
  },
  "edges": [
    {
      "id": "E5-9",
      "faceA": {
        "id": 5,
        "name": "Market Resonance",
        "energy": 0.381966
      },
      "faceB": {
        "id": 9,
        "name": "Regenerative Flow",
        "energy": 0.381966
      },
      "philosophy": {
        "element": "0.392090",
        "question": "0.106",
        "archetype": "The relationship between Market Resonance and Regenerative Flow"
      },
      "computed": {
        "tension": 0,
        "breathRatio": 0.046254,
        "kpiCoherence": 0.438344,
        "wasSubstituted": true
      },
      "diagnostics": {
        "status": "critical",
        "interpretation": "Projecting more than receiving in this connection"
      }
    },
    {
      "id": "E5-8",
      "faceA": {
        "id": 5,
        "name": "Market Resonance",
        "energy": 0.381966
      },
      "faceB": {
        "id": 8,
        "name": "Core Operations",
        "energy": 0.381966
      },
      "philosophy": {
        "element": "0.174637",
        "question": "0.209",
        "archetype": "The relationship between Market Resonance and Core Operations"
      },
      "computed": {
        "tension": 0,
        "breathRatio": 0.046254,
        "kpiCoherence": 0.220891,
        "wasSubstituted": true
      },
      "diagnostics": {
        "status": "critical",
        "interpretation": "Projecting more than receiving in this connection"
      }
    },
    {
      "id": "E5-7",
      "faceA": {
        "id": 5,
        "name": "Market Resonance",
        "energy": 0.381966
      },
      "faceB": {
        "id": 7,
        "name": "Brand & Reputation",
        "energy": 0.381966
      },
      "philosophy": {
        "element": "0.161876",
        "question": "0.222",
        "archetype": "The relationship between Market Resonance and Brand & Reputation"
      },
      "computed": {
        "tension": 0,
        "breathRatio": 0.046254,
        "kpiCoherence": 0.20813,
        "wasSubstituted": true
      },
      "diagnostics": {
        "status": "critical",
        "interpretation": "Projecting more than receiving in this connection"
      }
    },
    {
      "id": "E5-12",
      "faceA": {
        "id": 5,
        "name": "Market Resonance",
        "energy": 0.381966
      },
      "faceB": {
        "id": 12,
        "name": "Risk & Resilience",
        "energy": 0.381966
      },
      "philosophy": {
        "element": "0.150073",
        "question": "0.236",
        "archetype": "The relationship between Market Resonance and Risk & Resilience"
      },
      "computed": {
        "tension": 0,
        "breathRatio": 0.046254,